{
  "runId": "run_20260512_001",
  "projectId": "credit-risk-demo",
  "status": "completed",
  "dataset": {
    "name": "credit-risk-demo.csv",
    "rows": 12000,
    "columns": 48
  },
  "prompt": {
    "goal": "建立信用卡逾期风险预测模型，识别未来 30 天高风险客户。",
    "systemPrompt": "自动执行多轮实验并输出最佳结果。",
    "userPrompt": "重点展示关键影响因素和实验过程。"
  },
  "config": {
    "maxLoops": 5,
    "evaluationMetric": "AUC",
    "baselineModels": ["xgboost", "lightgbm"]
  },
  "steps": [
    {
      "stepId": "step_01",
      "name": "数据校验",
      "type": "data_check",
      "status": "success",
      "summary": "完成缺失值、字段类型和目标字段校验。"
    },
    {
      "stepId": "step_02",
      "name": "基线建模",
      "type": "baseline_model",
      "status": "success",
      "summary": "使用 XGBoost 生成基线模型，验证集 AUC 为 0.8124。"
    },
    {
      "stepId": "step_03",
      "name": "特征优化",
      "type": "feature_iteration",
      "status": "success",
      "summary": "加入稳定业务衍生特征，验证集 AUC 提升到 0.8316。"
    }
  ],
  "result": {
    "bestLoop": "loop_05",
    "bestMetric": {
      "name": "AUC",
      "value": 0.8316
    },
    "artifacts": [
      {
        "name": "best-model.pkl",
        "type": "model"
      },
      {
        "name": "feature-importance.png",
        "type": "chart"
      }
    ],
    "summary": "当前最佳方案为 XGBoost + 稳定业务衍生特征 + 阈值校准。"
  }
}
